{
  "oati_version": "1.0",
  "id": "oati:receipt:example:read-1",
  "transaction_id": "oati:tx:example:read-1",
  "agent_id": "oati:agent:example:buyer",
  "organisation_id": "oati:org:example",
  "mandate_id": "oati:mandate:example:read-1",
  "decision": "allow",
  "outcome": "succeeded",
  "occurred_at": "2026-07-27T12:01:00Z",
  "issuer": "oati:issuer:example:enterprise",
  "proof": {
    "type": "OatiJwsProof2026",
    "cryptosuite": "eddsa-jcs-2022",
    "algorithm": "EdDSA",
    "created": "2026-07-27T12:01:00Z",
    "expires": "2026-07-27T12:06:00Z",
    "verification_method": "oati:key:example:signing-1",
    "proof_purpose": "assertionMethod",
    "audience": "https://service.example",
    "nonce": "example-receipt-proof-0001",
    "signature": "ZXhhbXBsZQ..c2lnbmF0dXJl"
  }
}
